[2025-06-15 11:54:58] Ether / IP / TCP 192.168.29.92:49823 > 20.190.145.143:https PA / Raw
[2025-06-15 11:54:58] Ether / IP / TCP 20.190.145.143:https > 192.168.29.92:49823 PA / Raw
[2025-06-15 11:54:58] Ether / IP / TCP 192.168.29.92:49823 > 20.190.145.143:https PA / Raw
[2025-06-15 11:54:58] Ether / IP / TCP 192.168.29.92:49823 > 20.190.145.143:https A / Raw
[2025-06-15 11:54:58] Ether / IP / TCP 192.168.29.92:49823 > 20.190.145.143:https A / Raw
[2025-06-15 11:54:58] Ether / IP / TCP 192.168.29.92:49823 > 20.190.145.143:https A / Raw
[2025-06-15 11:54:58] Ether / IP / TCP 192.168.29.92:49823 > 20.190.145.143:https A / Raw
[2025-06-15 11:54:58] Ether / IP / TCP 192.168.29.92:49823 > 20.190.145.143:https PA / Raw
[2025-06-15 11:54:58] Ether / IP / TCP 20.190.145.143:https > 192.168.29.92:49823 A
[2025-06-15 11:54:58] Ether / IP / TCP 192.168.29.92:49818 > 40.79.167.8:https PA / Raw
[2025-06-15 11:54:58] Ether / IP / TCP 192.168.29.92:49818 > 40.79.167.8:https PA / Raw
[2025-06-15 11:54:58] Ether / IP / TCP 40.79.167.8:https > 192.168.29.92:49818 A
[2025-06-15 11:54:58] Ether / IP / TCP 40.79.167.8:https > 192.168.29.92:49818 PA / Raw
[2025-06-15 11:54:58] Ether / IP / TCP 192.168.29.92:49818 > 40.79.167.8:https A
[2025-06-15 11:54:58] Ether / IP / TCP 20.190.145.143:https > 192.168.29.92:49823 A / Raw
[2025-06-15 11:54:58] Ether / IP / TCP 20.190.145.143:https > 192.168.29.92:49823 A / Raw
[2025-06-15 11:54:58] Ether / IP / TCP 192.168.29.92:49823 > 20.190.145.143:https A
[2025-06-15 11:54:58] Ether / IP / TCP 20.190.145.143:https > 192.168.29.92:49823 A / Raw
[2025-06-15 11:54:58] Ether / IP / TCP 20.190.145.143:https > 192.168.29.92:49823 A / Raw
[2025-06-15 11:54:58] Ether / IP / TCP 192.168.29.92:49823 > 20.190.145.143:https A
[2025-06-15 11:54:58] Ether / IP / TCP 20.190.145.143:https > 192.168.29.92:49823 A / Raw
[2025-06-15 11:54:58] Ether / IP / TCP 20.190.145.143:https > 192.168.29.92:49823 A / Raw
[2025-06-15 11:54:58] Ether / IP / TCP 192.168.29.92:49823 > 20.190.145.143:https A
[2025-06-15 11:54:58] Ether / IP / TCP 20.190.145.143:https > 192.168.29.92:49823 A / Raw
[2025-06-15 11:54:58] Ether / IP / TCP 20.190.145.143:https > 192.168.29.92:49823 A / Raw
[2025-06-15 11:54:58] Ether / IP / TCP 192.168.29.92:49823 > 20.190.145.143:https A
[2025-06-15 11:54:58] Ether / IP / TCP 20.190.145.143:https > 192.168.29.92:49823 A / Raw
[2025-06-15 11:54:58] Ether / IP / TCP 20.190.145.143:https > 192.168.29.92:49823 A / Raw
[2025-06-15 11:54:58] Ether / IP / TCP 192.168.29.92:49823 > 20.190.145.143:https A
[2025-06-15 11:54:58] Ether / IP / TCP 20.190.145.143:https > 192.168.29.92:49823 A / Raw
[2025-06-15 11:54:58] Ether / IP / TCP 20.190.145.143:https > 192.168.29.92:49823 A / Raw
[2025-06-15 11:54:58] Ether / IP / TCP 192.168.29.92:49823 > 20.190.145.143:https A
[2025-06-15 11:54:58] Ether / IP / TCP 20.190.145.143:https > 192.168.29.92:49823 A / Raw
[2025-06-15 11:54:58] Ether / IP / TCP 20.190.145.143:https > 192.168.29.92:49823 A / Raw
[2025-06-15 11:54:58] Ether / IP / TCP 20.190.145.143:https > 192.168.29.92:49823 PA / Raw
[2025-06-15 11:54:58] Ether / IP / TCP 192.168.29.92:49823 > 20.190.145.143:https A
[2025-06-15 11:54:59] Ether / 192.168.29.92 > 224.0.0.22 2 / Raw
[2025-06-15 11:54:59] Ether / IP / TCP 192.168.29.92:49823 > 20.190.145.143:https PA / Raw
[2025-06-15 11:54:59] Ether / IP / TCP 192.168.29.92:49823 > 20.190.145.143:https A / Raw
[2025-06-15 11:54:59] Ether / IP / TCP 192.168.29.92:49823 > 20.190.145.143:https A / Raw
[2025-06-15 11:54:59] Ether / IP / TCP 192.168.29.92:49823 > 20.190.145.143:https A / Raw
[2025-06-15 11:54:59] Ether / IP / TCP 192.168.29.92:49823 > 20.190.145.143:https A / Raw
[2025-06-15 11:54:59] Ether / IP / TCP 192.168.29.92:49823 > 20.190.145.143:https PA / Raw
[2025-06-15 11:54:59] Ether / IP / TCP 20.190.145.143:https > 192.168.29.92:49823 A
[2025-06-15 11:54:59] Ether / IP / TCP 20.190.145.143:https > 192.168.29.92:49823 A
[2025-06-15 11:54:59] Ether / IP / TCP 20.190.145.143:https > 192.168.29.92:49823 A / Raw
[2025-06-15 11:54:59] Ether / IP / TCP 192.168.29.92:49823 > 20.190.145.143:https A
[2025-06-15 11:54:59] Ether / IP / TCP 20.190.145.143:https > 192.168.29.92:49823 A / Raw
[2025-06-15 11:54:59] Ether / IP / TCP 20.190.145.143:https > 192.168.29.92:49823 PA / Raw
[2025-06-15 11:54:59] Ether / IP / TCP 192.168.29.92:49823 > 20.190.145.143:https A
[2025-06-15 11:54:59] Ether / IP / TCP 192.168.29.92:49821 > 204.79.197.203:https FA
[2025-06-15 11:54:59] Ether / IP / TCP 192.168.29.92:49817 > 204.79.197.203:https FA
[2025-06-15 11:54:59] Ether / IP / TCP 204.79.197.203:https > 192.168.29.92:49817 A
[2025-06-15 11:54:59] Ether / IP / TCP 204.79.197.203:https > 192.168.29.92:49817 FA
[2025-06-15 11:54:59] Ether / IP / TCP 192.168.29.92:49817 > 204.79.197.203:https A
[2025-06-15 11:54:59] Ether / IP / TCP 204.79.197.203:https > 192.168.29.92:49821 A
[2025-06-15 11:54:59] Ether / IP / TCP 204.79.197.203:https > 192.168.29.92:49821 RA
[2025-06-15 11:55:02] Ether / IP / TCP 192.168.29.92:49738 > 35.162.53.240:https PA / Raw
[2025-06-15 11:55:02] Ether / IP / TCP 192.168.29.92:49738 > 35.162.53.240:https A / Raw
[2025-06-15 11:55:02] Ether / IP / TCP 192.168.29.92:49738 > 35.162.53.240:https A / Raw
[2025-06-15 11:55:02] Ether / IP / TCP 192.168.29.92:49738 > 35.162.53.240:https PA / Raw
[2025-06-15 11:55:02] Ether / IP / TCP 192.168.29.92:49835 > 35.162.53.240:https S
[2025-06-15 11:55:03] Ether / IP / TCP 35.162.53.240:https > 192.168.29.92:49738 A
[2025-06-15 11:55:03] Ether / IP / TCP 35.162.53.240:https > 192.168.29.92:49738 PA / Raw
[2025-06-15 11:55:03] Ether / IP / TCP 35.162.53.240:https > 192.168.29.92:49738 PA / Raw
[2025-06-15 11:55:03] Ether / IP / TCP 35.162.53.240:https > 192.168.29.92:49835 SA
[2025-06-15 11:55:03] Ether / IP / TCP 192.168.29.92:49738 > 35.162.53.240:https A
[2025-06-15 11:55:03] Ether / IP / TCP 192.168.29.92:49835 > 35.162.53.240:https A
[2025-06-15 11:55:03] Ether / IP / TCP 192.168.29.92:49835 > 35.162.53.240:https PA / Raw
[2025-06-15 11:55:03] Ether / IP / TCP 35.162.53.240:https > 192.168.29.92:49835 A
[2025-06-15 11:55:03] Ether / IP / TCP 35.162.53.240:https > 192.168.29.92:49835 A / Raw
[2025-06-15 11:55:03] Ether / IP / TCP 35.162.53.240:https > 192.168.29.92:49835 A / Raw
[2025-06-15 11:55:03] Ether / IP / TCP 35.162.53.240:https > 192.168.29.92:49835 PA / Raw
[2025-06-15 11:55:03] Ether / IP / TCP 192.168.29.92:49835 > 35.162.53.240:https A
[2025-06-15 11:55:03] Ether / IP / TCP 192.168.29.92:49835 > 35.162.53.240:https PA / Raw
[2025-06-15 11:55:03] Ether / IP / TCP 35.162.53.240:https > 192.168.29.92:49835 A
[2025-06-15 11:55:03] Ether / IP / TCP 35.162.53.240:https > 192.168.29.92:49835 PA / Raw
[2025-06-15 11:55:03] Ether / IP / TCP 35.162.53.240:https > 192.168.29.92:49835 PA / Raw
[2025-06-15 11:55:03] Ether / IP / TCP 192.168.29.92:49835 > 35.162.53.240:https A
[2025-06-15 11:55:03] Ether / IP / TCP 192.168.29.92:49835 > 35.162.53.240:https PA / Raw
[2025-06-15 11:55:03] Ether / IP / TCP 192.168.29.92:49835 > 35.162.53.240:https PA / Raw
[2025-06-15 11:55:03] Ether / IP / TCP 192.168.29.92:49835 > 35.162.53.240:https PA / Raw
[2025-06-15 11:55:03] Ether / IP / TCP 192.168.29.92:49835 > 35.162.53.240:https PA / Raw
[2025-06-15 11:55:04] Ether / IP / TCP 35.162.53.240:https > 192.168.29.92:49835 A
[2025-06-15 11:55:04] Ether / IP / TCP 35.162.53.240:https > 192.168.29.92:49835 PA / Raw
[2025-06-15 11:55:04] Ether / IP / TCP 35.162.53.240:https > 192.168.29.92:49835 PA / Raw
[2025-06-15 11:55:04] Ether / IP / TCP 35.162.53.240:https > 192.168.29.92:49835 PA / Raw
[2025-06-15 11:55:04] Ether / IP / TCP 192.168.29.92:49835 > 35.162.53.240:https A
[2025-06-15 11:55:04] Ether / IP / TCP 192.168.29.92:49835 > 35.162.53.240:https FA
[2025-06-15 11:55:04] Ether / IP / TCP 35.162.53.240:https > 192.168.29.92:49835 PA / Raw
[2025-06-15 11:55:04] Ether / IP / TCP 35.162.53.240:https > 192.168.29.92:49835 FA
[2025-06-15 11:55:04] Ether / IP / TCP 192.168.29.92:49835 > 35.162.53.240:https RA
[2025-06-15 11:55:06] Ether / IP / TCP 192.168.29.92:49837 > 13.107.6.158:https S
[2025-06-15 11:55:06] Ether / IP / TCP 13.107.6.158:https > 192.168.29.92:49837 SA
[2025-06-15 11:55:06] Ether / IP / TCP 192.168.29.92:49837 > 13.107.6.158:https A
[2025-06-15 11:55:06] Ether / IP / TCP 192.168.29.92:49837 > 13.107.6.158:https PA / Raw
[2025-06-15 11:55:06] Ether / IP / TCP 13.107.6.158:https > 192.168.29.92:49837 A
[2025-06-15 11:55:06] Ether / IP / TCP 13.107.6.158:https > 192.168.29.92:49837 A / Raw
[2025-06-15 11:55:06] Ether / IP / TCP 13.107.6.158:https > 192.168.29.92:49837 A / Raw
[2025-06-15 11:55:06] Ether / IP / TCP 13.107.6.158:https > 192.168.29.92:49837 PA / Raw
[2025-06-15 11:55:06] Ether / IP / TCP 192.168.29.92:49837 > 13.107.6.158:https A
[2025-06-15 11:55:06] Ether / IP / TCP 192.168.29.92:49837 > 13.107.6.158:https PA / Raw
[2025-06-15 11:55:06] Ether / IP / TCP 13.107.6.158:https > 192.168.29.92:49837 A
[2025-06-15 11:55:06] Ether / IP / TCP 13.107.6.158:https > 192.168.29.92:49837 PA / Raw
[2025-06-15 11:55:06] Ether / IP / TCP 192.168.29.92:49837 > 13.107.6.158:https A / Raw
[2025-06-15 11:55:06] Ether / IP / TCP 192.168.29.92:49837 > 13.107.6.158:https A / Raw
[2025-06-15 11:55:06] Ether / IP / TCP 192.168.29.92:49837 > 13.107.6.158:https PA / Raw
[2025-06-15 11:55:06] Ether / IP / TCP 13.107.6.158:https > 192.168.29.92:49837 A
[2025-06-15 11:55:07] Ether / IP / TCP 13.107.6.158:https > 192.168.29.92:49837 PA / Raw
[2025-06-15 11:55:07] Ether / IP / TCP 13.107.6.158:https > 192.168.29.92:49837 A / Raw
[2025-06-15 11:55:07] Ether / IP / TCP 13.107.6.158:https > 192.168.29.92:49837 PA / Raw
[2025-06-15 11:55:07] Ether / IP / TCP 192.168.29.92:49837 > 13.107.6.158:https A
[2025-06-15 11:55:07] Ether / IP / TCP 192.168.29.92:49838 > 13.107.6.158:https S
[2025-06-15 11:55:07] Ether / IP / TCP 13.107.6.158:https > 192.168.29.92:49838 SA
[2025-06-15 11:55:07] Ether / IP / TCP 192.168.29.92:49838 > 13.107.6.158:https A
[2025-06-15 11:55:07] Ether / IP / TCP 192.168.29.92:49838 > 13.107.6.158:https PA / Raw
[2025-06-15 11:55:07] Ether / IP / TCP 13.107.6.158:https > 192.168.29.92:49838 A
[2025-06-15 11:55:07] Ether / IP / TCP 13.107.6.158:https > 192.168.29.92:49838 A / Raw
[2025-06-15 11:55:07] Ether / IP / TCP 13.107.6.158:https > 192.168.29.92:49838 PA / Raw
[2025-06-15 11:55:07] Ether / IP / TCP 192.168.29.92:49838 > 13.107.6.158:https A
[2025-06-15 11:55:07] Ether / IP / TCP 192.168.29.92:49838 > 13.107.6.158:https PA / Raw
[2025-06-15 11:55:07] Ether / IP / TCP 192.168.29.92:49838 > 13.107.6.158:https A / Raw
[2025-06-15 11:55:07] Ether / IP / TCP 192.168.29.92:49838 > 13.107.6.158:https A / Raw
[2025-06-15 11:55:07] Ether / IP / TCP 192.168.29.92:49838 > 13.107.6.158:https PA / Raw
[2025-06-15 11:55:07] Ether / IP / TCP 13.107.6.158:https > 192.168.29.92:49838 A
[2025-06-15 11:55:07] Ether / IP / TCP 13.107.6.158:https > 192.168.29.92:49838 PA / Raw
[2025-06-15 11:55:07] Ether / IP / TCP 13.107.6.158:https > 192.168.29.92:49838 A
[2025-06-15 11:55:07] Ether / IP / TCP 192.168.29.92:49838 > 13.107.6.158:https A
[2025-06-15 11:55:08] Ether / IP / TCP 13.107.6.158:https > 192.168.29.92:49838 PA / Raw
[2025-06-15 11:55:08] Ether / IP / TCP 192.168.29.92:49838 > 13.107.6.158:https A
[2025-06-15 11:55:08] Ether / IP / TCP 192.168.29.92:49839 > 216.137.52.116:https S
[2025-06-15 11:55:08] Ether / IP / TCP 216.137.52.116:https > 192.168.29.92:49839 SA
[2025-06-15 11:55:08] Ether / IP / TCP 192.168.29.92:49839 > 216.137.52.116:https A
[2025-06-15 11:55:08] Ether / IP / TCP 192.168.29.92:49839 > 216.137.52.116:https PA / Raw
[2025-06-15 11:55:08] Ether / IP / TCP 216.137.52.116:https > 192.168.29.92:49839 A
[2025-06-15 11:55:08] Ether / IP / TCP 216.137.52.116:https > 192.168.29.92:49839 A / Raw
[2025-06-15 11:55:08] Ether / IP / TCP 216.137.52.116:https > 192.168.29.92:49839 PA / Raw
[2025-06-15 11:55:08] Ether / IP / TCP 192.168.29.92:49839 > 216.137.52.116:https A
[2025-06-15 11:55:08] Ether / IP / TCP 216.137.52.116:https > 192.168.29.92:49839 A / Raw
[2025-06-15 11:55:08] Ether / IP / TCP 216.137.52.116:https > 192.168.29.92:49839 A / Raw
[2025-06-15 11:55:08] Ether / IP / TCP 216.137.52.116:https > 192.168.29.92:49839 PA / Raw
[2025-06-15 11:55:08] Ether / IP / TCP 192.168.29.92:49839 > 216.137.52.116:https A
[2025-06-15 11:55:08] Ether / IP / TCP 192.168.29.92:49839 > 216.137.52.116:https PA / Raw
[2025-06-15 11:55:08] Ether / IP / TCP 216.137.52.116:https > 192.168.29.92:49839 A
[2025-06-15 11:55:08] Ether / IP / TCP 216.137.52.116:https > 192.168.29.92:49839 PA / Raw
[2025-06-15 11:55:08] Ether / IP / TCP 216.137.52.116:https > 192.168.29.92:49839 PA / Raw
[2025-06-15 11:55:08] Ether / IP / TCP 192.168.29.92:49839 > 216.137.52.116:https A
[2025-06-15 11:55:08] Ether / IP / TCP 192.168.29.92:49839 > 216.137.52.116:https PA / Raw
[2025-06-15 11:55:08] Ether / IP / TCP 192.168.29.92:49839 > 216.137.52.116:https PA / Raw
[2025-06-15 11:55:08] Ether / IP / TCP 192.168.29.92:49839 > 216.137.52.116:https PA / Raw
[2025-06-15 11:55:08] Ether / IP / TCP 192.168.29.92:49839 > 216.137.52.116:https PA / Raw
[2025-06-15 11:55:09] Ether / IP / TCP 216.137.52.116:https > 192.168.29.92:49839 A
[2025-06-15 11:55:09] Ether / IP / TCP 216.137.52.116:https > 192.168.29.92:49839 PA / Raw
[2025-06-15 11:55:09] Ether / IP / TCP 192.168.29.92:49839 > 216.137.52.116:https A
[2025-06-15 11:55:09] Ether / IP / TCP 216.137.52.116:https > 192.168.29.92:49839 A / Raw
[2025-06-15 11:55:09] Ether / IP / TCP 216.137.52.116:https > 192.168.29.92:49839 PA / Raw
[2025-06-15 11:55:09] Ether / IP / TCP 192.168.29.92:49839 > 216.137.52.116:https A
[2025-06-15 11:55:09] Ether / IP / TCP 216.137.52.116:https > 192.168.29.92:49839 PA / Raw
[2025-06-15 11:55:09] Ether / IP / TCP 192.168.29.92:49839 > 216.137.52.116:https FA
[2025-06-15 11:55:09] Ether / IP / TCP 192.168.29.92:49840 > 35.162.53.240:https S
[2025-06-15 11:55:09] Ether / IP / TCP 216.137.52.116:https > 192.168.29.92:49839 FA
[2025-06-15 11:55:09] Ether / IP / TCP 192.168.29.92:49839 > 216.137.52.116:https A
[2025-06-15 11:55:09] Ether / IP / TCP 35.162.53.240:https > 192.168.29.92:49840 SA
[2025-06-15 11:55:09] Ether / IP / TCP 192.168.29.92:49840 > 35.162.53.240:https A
[2025-06-15 11:55:09] Ether / IP / TCP 192.168.29.92:49840 > 35.162.53.240:https PA / Raw
[2025-06-15 11:55:09] Ether / IP / TCP 35.162.53.240:https > 192.168.29.92:49840 A
[2025-06-15 11:55:09] Ether / IP / TCP 35.162.53.240:https > 192.168.29.92:49840 A / Raw
[2025-06-15 11:55:09] Ether / IP / TCP 35.162.53.240:https > 192.168.29.92:49840 A / Raw
[2025-06-15 11:55:09] Ether / IP / TCP 35.162.53.240:https > 192.168.29.92:49840 PA / Raw
[2025-06-15 11:55:09] Ether / IP / TCP 192.168.29.92:49840 > 35.162.53.240:https A
[2025-06-15 11:55:09] Ether / IP / TCP 192.168.29.92:49840 > 35.162.53.240:https PA / Raw
[2025-06-15 11:55:10] Ether / IP / TCP 35.162.53.240:https > 192.168.29.92:49840 A
[2025-06-15 11:55:10] Ether / IP / TCP 35.162.53.240:https > 192.168.29.92:49840 PA / Raw
[2025-06-15 11:55:10] Ether / IP / TCP 35.162.53.240:https > 192.168.29.92:49840 PA / Raw
[2025-06-15 11:55:10] Ether / IP / TCP 192.168.29.92:49840 > 35.162.53.240:https A
[2025-06-15 11:55:10] Ether / IP / TCP 192.168.29.92:49840 > 35.162.53.240:https PA / Raw
[2025-06-15 11:55:10] Ether / IP / TCP 192.168.29.92:49840 > 35.162.53.240:https PA / Raw
[2025-06-15 11:55:10] Ether / IP / TCP 192.168.29.92:49840 > 35.162.53.240:https PA / Raw
[2025-06-15 11:55:10] Ether / IP / TCP 192.168.29.92:49840 > 35.162.53.240:https PA / Raw
[2025-06-15 11:55:10] Ether / IP / TCP 35.162.53.240:https > 192.168.29.92:49840 A
[2025-06-15 11:55:10] Ether / IP / TCP 35.162.53.240:https > 192.168.29.92:49840 PA / Raw
[2025-06-15 11:55:10] Ether / IP / TCP 35.162.53.240:https > 192.168.29.92:49840 PA / Raw
[2025-06-15 11:55:10] Ether / IP / TCP 35.162.53.240:https > 192.168.29.92:49840 PA / Raw
[2025-06-15 11:55:10] Ether / IP / TCP 192.168.29.92:49840 > 35.162.53.240:https A
[2025-06-15 11:55:10] Ether / IP / TCP 192.168.29.92:49840 > 35.162.53.240:https FA
[2025-06-15 11:55:10] Ether / IP / TCP 35.162.53.240:https > 192.168.29.92:49840 PA / Raw
[2025-06-15 11:55:10] Ether / IP / TCP 35.162.53.240:https > 192.168.29.92:49840 FA
[2025-06-15 11:55:10] Ether / IP / TCP 192.168.29.92:49840 > 35.162.53.240:https RA
[2025-06-15 12:12:05] Ether / 192.168.29.92 > 224.0.0.22 2 / Raw
[2025-06-15 12:13:20] Ether / IP / TCP 20.42.65.93:https > 192.168.29.92:50283 A
[2025-06-15 12:13:22] Ether / 192.168.29.92 > 224.0.0.22 2 / Raw
[2025-06-15 12:13:23] Ether / IP / TCP 104.199.241.202:4070 > 192.168.29.92:49857 PA / Raw
[2025-06-15 12:13:23] Ether / IP / TCP 192.168.29.92:49857 > 104.199.241.202:4070 A
[2025-06-15 12:13:25] Ether / IP / UDP 192.168.29.92:57621 > 192.168.29.255:57621 / Raw
[2025-06-15 12:13:27] Ether / IP / UDP 192.168.29.1:60784 > 192.168.29.92:echo / Raw
[2025-06-15 12:13:34] Ether / IP / TCP 192.168.29.92:50290 > 192.168.29.1:domain S
[2025-06-15 12:13:34] Ether / IP / TCP 192.168.29.92:50291 > 192.168.29.1:domain S
[2025-06-15 12:13:34] Ether / IP / TCP 192.168.29.92:50292 > 192.168.29.1:domain S
[2025-06-15 12:13:35] Ether / IP / TCP 192.168.29.92:50290 > 192.168.29.1:domain S
[2025-06-15 12:13:35] Ether / IP / TCP 192.168.29.92:50291 > 192.168.29.1:domain S
[2025-06-15 12:13:35] Ether / IP / TCP 192.168.29.92:50292 > 192.168.29.1:domain S
[2025-06-15 12:13:35] Ether / IP / TCP 192.168.29.92:49888 > 13.89.179.10:https A / Raw
[2025-06-15 12:13:36] Ether / IP / TCP 13.89.179.10:https > 192.168.29.92:49888 A
[2025-06-15 12:13:37] Ether / IP / TCP 192.168.29.92:50290 > 192.168.29.1:domain S
[2025-06-15 12:13:37] Ether / IP / TCP 192.168.29.92:50291 > 192.168.29.1:domain S
[2025-06-15 12:13:37] Ether / IP / TCP 192.168.29.92:50292 > 192.168.29.1:domain S
[2025-06-15 12:13:38] Ether / 192.168.29.1 > 224.0.0.1 2 / Raw
[2025-06-15 12:13:39] Ether / IP / TCP 192.168.29.92:50300 > 192.168.29.1:domain S
[2025-06-15 12:13:39] Ether / IP / TCP 192.168.29.92:50301 > 192.168.29.1:domain S
[2025-06-15 12:13:39] Ether / IP / TCP 192.168.29.92:50302 > 192.168.29.1:domain S
[2025-06-15 12:13:40] Ether / IP / TCP 192.168.29.92:49888 > 13.89.179.10:https PA / Raw
[2025-06-15 12:13:40] Ether / IP / TCP 192.168.29.92:49888 > 13.89.179.10:https PA / Raw
[2025-06-15 12:13:40] Ether / IP / TCP 192.168.29.92:49888 > 13.89.179.10:https A / Raw
[2025-06-15 12:13:40] Ether / IP / TCP 192.168.29.92:49888 > 13.89.179.10:https A / Raw
[2025-06-15 12:13:40] Ether / IP / TCP 192.168.29.92:49888 > 13.89.179.10:https A / Raw
[2025-06-15 12:13:40] Ether / IP / TCP 192.168.29.92:49888 > 13.89.179.10:https A / Raw
[2025-06-15 12:13:40] Ether / IP / TCP 192.168.29.92:49888 > 13.89.179.10:https A / Raw
[2025-06-15 12:13:40] Ether / IP / TCP 192.168.29.92:49888 > 13.89.179.10:https A / Raw
[2025-06-15 12:13:40] Ether / IP / TCP 192.168.29.92:49888 > 13.89.179.10:https A / Raw
[2025-06-15 12:13:40] Ether / IP / TCP 192.168.29.92:49888 > 13.89.179.10:https A / Raw
[2025-06-15 12:13:40] Ether / IP / TCP 192.168.29.92:49888 > 13.89.179.10:https A / Raw
[2025-06-15 12:13:40] Ether / IP / TCP 192.168.29.92:49888 > 13.89.179.10:https A / Raw
[2025-06-15 12:13:40] Ether / IP / TCP 192.168.29.92:49888 > 13.89.179.10:https A / Raw
[2025-06-15 12:13:40] Ether / IP / TCP 192.168.29.92:49888 > 13.89.179.10:https PA / Raw
[2025-06-15 12:13:40] Ether / IP / TCP 192.168.29.92:49888 > 13.89.179.10:https PA / Raw
[2025-06-15 12:13:40] Ether / IP / TCP 13.89.179.10:https > 192.168.29.92:49888 A
[2025-06-15 12:13:40] Ether / IP / TCP 13.89.179.10:https > 192.168.29.92:49888 PA / Raw
[2025-06-15 12:13:40] Ether / IP / TCP 13.89.179.10:https > 192.168.29.92:49888 A
[2025-06-15 12:13:40] Ether / IP / TCP 13.89.179.10:https > 192.168.29.92:49888 A
[2025-06-15 12:13:40] Ether / IP / TCP 13.89.179.10:https > 192.168.29.92:49888 PA / Raw
[2025-06-15 12:13:40] Ether / IP / TCP 192.168.29.92:49888 > 13.89.179.10:https A
[2025-06-15 12:13:40] Ether / IP / TCP 13.89.179.10:https > 192.168.29.92:49888 PA / Raw
[2025-06-15 12:13:40] Ether / IP / TCP 192.168.29.92:49888 > 13.89.179.10:https PA / Raw
[2025-06-15 12:13:40] Ether / IP / TCP 192.168.29.92:50300 > 192.168.29.1:domain S
[2025-06-15 12:13:40] Ether / IP / TCP 192.168.29.92:50301 > 192.168.29.1:domain S
[2025-06-15 12:13:40] Ether / IP / TCP 192.168.29.92:50302 > 192.168.29.1:domain S
[2025-06-15 12:13:41] Ether / IP / TCP 192.168.29.92:49888 > 13.89.179.10:https PA / Raw
[2025-06-15 12:13:41] Ether / IP / TCP 13.89.179.10:https > 192.168.29.92:49888 A
[2025-06-15 12:13:41] Ether / IP / TCP 13.89.179.10:https > 192.168.29.92:49888 A
[2025-06-15 12:13:41] Ether / IP / TCP 192.168.29.92:50290 > 192.168.29.1:domain S
[2025-06-15 12:13:41] Ether / IP / TCP 192.168.29.92:50291 > 192.168.29.1:domain S
[2025-06-15 12:13:41] Ether / IP / TCP 192.168.29.92:50292 > 192.168.29.1:domain S
[2025-06-15 12:13:41] Ether / IP / UDP 192.168.29.92:64083 > 239.255.255.250:ssdp / Raw
[2025-06-15 12:13:42] Ether / IP / TCP 192.168.29.92:49888 > 13.89.179.10:https PA / Raw
[2025-06-15 12:13:42] Ether / IP / TCP 192.168.29.92:49888 > 13.89.179.10:https A / Raw
[2025-06-15 12:13:42] Ether / IP / TCP 192.168.29.92:49888 > 13.89.179.10:https A / Raw
[2025-06-15 12:13:42] Ether / IP / TCP 192.168.29.92:49888 > 13.89.179.10:https A / Raw
[2025-06-15 12:13:42] Ether / IP / TCP 192.168.29.92:49888 > 13.89.179.10:https A / Raw
[2025-06-15 12:13:42] Ether / IP / TCP 192.168.29.92:49888 > 13.89.179.10:https A / Raw
[2025-06-15 12:13:42] Ether / IP / TCP 192.168.29.92:49888 > 13.89.179.10:https A / Raw
[2025-06-15 12:13:42] Ether / IP / TCP 192.168.29.92:49888 > 13.89.179.10:https A / Raw
[2025-06-15 12:13:42] Ether / IP / TCP 192.168.29.92:49888 > 13.89.179.10:https A / Raw
[2025-06-15 12:13:42] Ether / IP / TCP 192.168.29.92:49888 > 13.89.179.10:https A / Raw
[2025-06-15 12:13:42] Ether / IP / TCP 192.168.29.92:49888 > 13.89.179.10:https A / Raw
[2025-06-15 12:13:42] Ether / IP / TCP 192.168.29.92:49888 > 13.89.179.10:https A / Raw
[2025-06-15 12:13:42] Ether / IP / TCP 192.168.29.92:49888 > 13.89.179.10:https PA / Raw
[2025-06-15 12:13:42] Ether / IP / TCP 192.168.29.92:49888 > 13.89.179.10:https PA / Raw
[2025-06-15 12:13:42] Ether / IP / TCP 13.89.179.10:https > 192.168.29.92:49888 A
[2025-06-15 12:13:42] Ether / IP / TCP 13.89.179.10:https > 192.168.29.92:49888 A
[2025-06-15 12:13:42] Ether / IP / TCP 13.89.179.10:https > 192.168.29.92:49888 A
[2025-06-15 12:13:42] Ether / IP / TCP 13.89.179.10:https > 192.168.29.92:49888 A
[2025-06-15 12:13:42] Ether / IP / TCP 13.89.179.10:https > 192.168.29.92:49888 PA / Raw
[2025-06-15 12:13:42] Ether / IP / TCP 192.168.29.92:49888 > 13.89.179.10:https A
[2025-06-15 12:13:42] Ether / 192.168.29.92 > 224.0.0.22 2 / Raw
[2025-06-15 12:13:43] Ether / IP / UDP 192.168.29.92:64083 > 239.255.255.250:ssdp / Raw
[2025-06-15 12:13:44] Ether / IP / UDP 192.168.29.92:64083 > 239.255.255.250:ssdp / Raw
[2025-06-15 12:13:44] Ether / IP / TCP 192.168.29.92:49888 > 13.89.179.10:https PA / Raw
[2025-06-15 12:13:44] Ether / IP / TCP 192.168.29.92:49888 > 13.89.179.10:https A / Raw
[2025-06-15 12:13:44] Ether / IP / TCP 192.168.29.92:49888 > 13.89.179.10:https A / Raw
[2025-06-15 12:13:44] Ether / IP / TCP 192.168.29.92:49888 > 13.89.179.10:https A / Raw
[2025-06-15 12:13:44] Ether / IP / TCP 192.168.29.92:49888 > 13.89.179.10:https A / Raw
[2025-06-15 12:13:44] Ether / IP / TCP 192.168.29.92:49888 > 13.89.179.10:https A / Raw
[2025-06-15 12:13:44] Ether / IP / TCP 192.168.29.92:49888 > 13.89.179.10:https A / Raw
[2025-06-15 12:13:44] Ether / IP / TCP 192.168.29.92:49888 > 13.89.179.10:https A / Raw
[2025-06-15 12:13:44] Ether / IP / TCP 192.168.29.92:49888 > 13.89.179.10:https A / Raw
[2025-06-15 12:13:44] Ether / IP / TCP 192.168.29.92:49888 > 13.89.179.10:https A / Raw
[2025-06-15 12:13:44] Ether / IP / TCP 192.168.29.92:49888 > 13.89.179.10:https PA / Raw
[2025-06-15 12:13:44] Ether / IP / TCP 13.89.179.10:https > 192.168.29.92:49888 A
[2025-06-15 12:13:44] Ether / IP / TCP 13.89.179.10:https > 192.168.29.92:49888 A
[2025-06-15 12:13:44] Ether / IP / TCP 13.89.179.10:https > 192.168.29.92:49888 A
[2025-06-15 12:13:44] Ether / IP / TCP 13.89.179.10:https > 192.168.29.92:49888 PA / Raw
[2025-06-15 12:13:44] Ether / IP / TCP 192.168.29.92:49888 > 13.89.179.10:https A
[2025-06-15 12:13:45] Ether / IP / UDP 192.168.29.92:64083 > 239.255.255.250:ssdp / Raw
[2025-06-15 12:13:46] Ether / 192.168.29.92 > 224.0.0.22 2 / Raw
[2025-06-15 12:13:46] Ether / IP / TCP 192.168.29.92:49888 > 13.89.179.10:https PA / Raw
[2025-06-15 12:13:46] Ether / IP / TCP 192.168.29.92:49888 > 13.89.179.10:https A / Raw
[2025-06-15 12:13:46] Ether / IP / TCP 192.168.29.92:49888 > 13.89.179.10:https A / Raw
[2025-06-15 12:13:46] Ether / IP / TCP 192.168.29.92:49888 > 13.89.179.10:https A / Raw
[2025-06-15 12:13:46] Ether / IP / TCP 192.168.29.92:49888 > 13.89.179.10:https A / Raw
[2025-06-15 12:13:46] Ether / IP / TCP 192.168.29.92:49888 > 13.89.179.10:https PA / Raw
[2025-06-15 12:13:47] Ether / IP / TCP 192.168.29.92:49888 > 13.89.179.10:https PA / Raw
[2025-06-15 12:13:47] Ether / IP / TCP 13.89.179.10:https > 192.168.29.92:49888 A
[2025-06-15 12:13:47] Ether / IP / TCP 13.89.179.10:https > 192.168.29.92:49888 A
[2025-06-15 12:13:47] Ether / IP / TCP 13.89.179.10:https > 192.168.29.92:49888 A
[2025-06-15 12:13:47] Ether / IP / TCP 13.89.179.10:https > 192.168.29.92:49888 PA / Raw
[2025-06-15 12:13:47] Ether / IP / TCP 192.168.29.92:49888 > 13.89.179.10:https PA / Raw
[2025-06-15 12:13:47] Ether / 192.168.29.92 > 224.0.0.22 2 / Raw
[2025-06-15 12:13:47] Ether / IP / TCP 13.89.179.10:https > 192.168.29.92:49888 A
[2025-06-15 12:13:47] Ether / IP / TCP 13.89.179.10:https > 192.168.29.92:49888 A
[2025-06-15 12:13:49] Ether / IP / TCP 192.168.29.92:49888 > 13.89.179.10:https PA / Raw
[2025-06-15 12:13:49] Ether / IP / TCP 192.168.29.92:49888 > 13.89.179.10:https A / Raw
[2025-06-15 12:13:49] Ether / IP / TCP 192.168.29.92:49888 > 13.89.179.10:https A / Raw
[2025-06-15 12:13:49] Ether / IP / TCP 192.168.29.92:49888 > 13.89.179.10:https A / Raw
[2025-06-15 12:13:49] Ether / IP / TCP 192.168.29.92:49888 > 13.89.179.10:https A / Raw
[2025-06-15 12:13:49] Ether / IP / TCP 192.168.29.92:49888 > 13.89.179.10:https PA / Raw
[2025-06-15 12:13:49] Ether / IP / TCP 13.89.179.10:https > 192.168.29.92:49888 A
[2025-06-15 12:13:49] Ether / IP / TCP 13.89.179.10:https > 192.168.29.92:49888 A
[2025-06-15 12:13:49] Ether / IP / TCP 13.89.179.10:https > 192.168.29.92:49888 PA / Raw
[2025-06-15 12:13:49] Ether / IP / TCP 192.168.29.92:49888 > 13.89.179.10:https A
[2025-06-15 12:13:51] Ether / IP / TCP 192.168.29.92:49888 > 13.89.179.10:https PA / Raw
[2025-06-15 12:13:51] Ether / IP / TCP 192.168.29.92:49888 > 13.89.179.10:https A / Raw
[2025-06-15 12:13:51] Ether / IP / TCP 192.168.29.92:49888 > 13.89.179.10:https A / Raw
[2025-06-15 12:13:51] Ether / IP / TCP 192.168.29.92:49888 > 13.89.179.10:https A / Raw
[2025-06-15 12:13:51] Ether / IP / TCP 192.168.29.92:49888 > 13.89.179.10:https PA / Raw
[2025-06-15 12:13:51] Ether / IP / TCP 13.89.179.10:https > 192.168.29.92:49888 A
[2025-06-15 12:13:51] Ether / IP / TCP 13.89.179.10:https > 192.168.29.92:49888 A
[2025-06-15 12:13:51] Ether / IP / TCP 13.89.179.10:https > 192.168.29.92:49888 PA / Raw
[2025-06-15 12:13:51] Ether / IP / TCP 192.168.29.92:49888 > 13.89.179.10:https A
[2025-06-15 12:13:53] Ether / IP / TCP 192.168.29.92:49888 > 13.89.179.10:https PA / Raw
[2025-06-15 12:13:53] Ether / IP / TCP 192.168.29.92:49888 > 13.89.179.10:https A / Raw
[2025-06-15 12:13:53] Ether / IP / TCP 192.168.29.92:49888 > 13.89.179.10:https A / Raw
[2025-06-15 12:13:53] Ether / IP / TCP 192.168.29.92:49888 > 13.89.179.10:https A / Raw
[2025-06-15 12:13:53] Ether / IP / TCP 192.168.29.92:49888 > 13.89.179.10:https A / Raw
[2025-06-15 12:13:53] Ether / IP / TCP 192.168.29.92:49888 > 13.89.179.10:https PA / Raw
[2025-06-15 12:13:53] Ether / IP / TCP 13.89.179.10:https > 192.168.29.92:49888 A
[2025-06-15 12:13:53] Ether / IP / TCP 13.89.179.10:https > 192.168.29.92:49888 PA / Raw
[2025-06-15 12:13:53] Ether / IP / TCP 192.168.29.92:49888 > 13.89.179.10:https PA / Raw
[2025-06-15 12:13:53] Ether / IP / TCP 13.89.179.10:https > 192.168.29.92:49888 A
[2025-06-15 12:13:55] Ether / IP / TCP 192.168.29.92:49888 > 13.89.179.10:https PA / Raw
[2025-06-15 12:13:55] Ether / IP / TCP 192.168.29.92:49888 > 13.89.179.10:https A / Raw
[2025-06-15 12:13:55] Ether / IP / TCP 192.168.29.92:49888 > 13.89.179.10:https A / Raw
[2025-06-15 12:13:55] Ether / IP / TCP 192.168.29.92:49888 > 13.89.179.10:https A / Raw
[2025-06-15 12:13:55] Ether / IP / TCP 192.168.29.92:49888 > 13.89.179.10:https A / Raw
[2025-06-15 12:13:55] Ether / IP / TCP 192.168.29.92:49888 > 13.89.179.10:https PA / Raw
[2025-06-15 12:13:55] Ether / IP / TCP 13.89.179.10:https > 192.168.29.92:49888 A
[2025-06-15 12:13:55] Ether / IP / TCP 13.89.179.10:https > 192.168.29.92:49888 A
[2025-06-15 12:13:55] Ether / IP / TCP 13.89.179.10:https > 192.168.29.92:49888 A
[2025-06-15 12:13:55] Ether / IP / TCP 13.89.179.10:https > 192.168.29.92:49888 PA / Raw
[2025-06-15 12:13:55] Ether / IP / TCP 192.168.29.92:49888 > 13.89.179.10:https A
[2025-06-15 12:13:55] Ether / IP / UDP 192.168.29.92:57621 > 192.168.29.255:57621 / Raw
[2025-06-15 12:27:47] IP / TCP 192.168.1.2:1234 > 192.168.1.10:http S
[2025-06-15 12:27:47] IP / UDP 10.0.0.5:5000 > 10.0.0.10:domain
[2025-06-15 12:27:47] IP / ICMP 8.8.8.8 > 192.168.1.1 echo-request 0
[2025-06-15 17:44:45] Ether / IP / TCP 20.42.73.26:https > 192.168.29.92:52938 FPA / Raw
[2025-06-15 17:44:45] Ether / IP / TCP 192.168.29.92:52938 > 20.42.73.26:https A
[2025-06-15 17:44:45] Ether / IP / TCP 192.168.29.92:52938 > 20.42.73.26:https PA / Raw
[2025-06-15 17:44:45] Ether / IP / TCP 192.168.29.92:52938 > 20.42.73.26:https FA
[2025-06-15 17:44:45] Ether / IP / TCP 20.42.73.26:https > 192.168.29.92:52938 A
[2025-06-15 17:44:46] Ether / 192.168.29.92 > 224.0.0.22 2 / Raw
[2025-06-15 17:44:49] Ether / IP / TCP 192.168.29.92:52924 > 20.42.65.90:https A / Raw
[2025-06-15 17:44:49] Ether / IP / TCP 192.168.29.92:52925 > 20.42.65.90:https A / Raw
[2025-06-15 17:44:49] Ether / IP / TCP 20.42.65.90:https > 192.168.29.92:52925 A
[2025-06-15 17:44:49] Ether / IP / TCP 20.42.65.90:https > 192.168.29.92:52924 A
[2025-06-15 17:44:49] Ether / IP / TCP 192.168.29.92:52927 > 172.188.215.153:https A / Raw
[2025-06-15 17:44:49] Ether / 192.168.29.92 > 224.0.0.22 2 / Raw
[2025-06-15 17:44:49] Ether / IP / TCP 172.188.215.153:https > 192.168.29.92:52927 A
[2025-06-15 17:44:50] Ether / IP / TCP 188.65.124.59:https > 192.168.29.92:52934 FA
[2025-06-15 17:44:50] Ether / IP / TCP 192.168.29.92:52934 > 188.65.124.59:https A
[2025-06-15 17:44:52] Ether / IP / TCP 192.168.29.92:52948 > 20.42.65.84:https S
[2025-06-15 17:44:52] Ether / IP / TCP 20.42.65.84:https > 192.168.29.92:52948 SA
[2025-06-15 17:44:52] Ether / IP / TCP 192.168.29.92:52948 > 20.42.65.84:https A
[2025-06-15 17:44:52] Ether / IP / TCP 192.168.29.92:52948 > 20.42.65.84:https A / Raw
[2025-06-15 17:44:52] Ether / IP / TCP 192.168.29.92:52948 > 20.42.65.84:https PA / Raw
[2025-06-15 17:44:52] Ether / IP / TCP 20.42.65.84:https > 192.168.29.92:52948 A
[2025-06-15 17:44:52] Ether / IP / TCP 20.42.65.84:https > 192.168.29.92:52948 PA / Raw
[2025-06-15 17:44:52] Ether / IP / TCP 192.168.29.92:52948 > 20.42.65.84:https PA / Raw
[2025-06-15 17:44:52] Ether / IP / TCP 20.42.65.84:https > 192.168.29.92:52948 A / Raw
[2025-06-15 17:44:52] Ether / IP / TCP 20.42.65.84:https > 192.168.29.92:52948 PA / Raw
[2025-06-15 17:44:52] Ether / IP / TCP 192.168.29.92:52948 > 20.42.65.84:https A
[2025-06-15 17:44:52] Ether / IP / TCP 192.168.29.92:52948 > 20.42.65.84:https PA / Raw
[2025-06-15 17:44:52] Ether / IP / TCP 192.168.29.92:52948 > 20.42.65.84:https PA / Raw
[2025-06-15 17:44:52] Ether / IP / TCP 192.168.29.92:52948 > 20.42.65.84:https PA / Raw
[2025-06-15 17:44:52] Ether / IP / TCP 192.168.29.92:52948 > 20.42.65.84:https A / Raw
[2025-06-15 17:44:52] Ether / IP / TCP 192.168.29.92:52948 > 20.42.65.84:https A / Raw
[2025-06-15 17:44:52] Ether / IP / TCP 192.168.29.92:52948 > 20.42.65.84:https A / Raw
[2025-06-15 17:44:52] Ether / IP / TCP 192.168.29.92:52948 > 20.42.65.84:https A / Raw
[2025-06-15 17:44:52] Ether / IP / TCP 192.168.29.92:52948 > 20.42.65.84:https PA / Raw
[2025-06-15 17:44:53] Ether / IP / TCP 20.42.65.84:https > 192.168.29.92:52948 A
[2025-06-15 17:44:53] Ether / IP / TCP 20.42.65.84:https > 192.168.29.92:52948 PA / Raw
[2025-06-15 17:44:53] Ether / IP / TCP 20.42.65.84:https > 192.168.29.92:52948 A
[2025-06-15 17:44:53] Ether / IP / TCP 20.42.65.84:https > 192.168.29.92:52948 A
[2025-06-15 17:44:53] Ether / IP / TCP 20.42.65.84:https > 192.168.29.92:52948 PA / Raw
[2025-06-15 17:44:53] Ether / IP / TCP 192.168.29.92:52948 > 20.42.65.84:https A
[2025-06-15 17:44:53] Ether / IP / TCP 192.168.29.92:52948 > 20.42.65.84:https PA / Raw
[2025-06-15 17:44:53] Ether / IP / TCP 20.42.65.84:https > 192.168.29.92:52948 PA / Raw
[2025-06-15 17:44:53] Ether / IP / TCP 192.168.29.92:52948 > 20.42.65.84:https A
[2025-06-15 17:44:54] Ether / IP / TCP 192.168.29.92:52948 > 20.42.65.84:https PA / Raw
[2025-06-15 17:44:54] Ether / IP / TCP 192.168.29.92:52948 > 20.42.65.84:https A / Raw
[2025-06-15 17:44:54] Ether / IP / TCP 192.168.29.92:52948 > 20.42.65.84:https A / Raw
[2025-06-15 17:44:54] Ether / IP / TCP 192.168.29.92:52948 > 20.42.65.84:https A / Raw
[2025-06-15 17:44:54] Ether / IP / TCP 192.168.29.92:52948 > 20.42.65.84:https A / Raw
[2025-06-15 17:44:54] Ether / IP / TCP 192.168.29.92:52948 > 20.42.65.84:https A / Raw
[2025-06-15 17:44:54] Ether / IP / TCP 192.168.29.92:52948 > 20.42.65.84:https A / Raw
[2025-06-15 17:44:54] Ether / IP / TCP 192.168.29.92:52948 > 20.42.65.84:https A / Raw
[2025-06-15 17:44:54] Ether / IP / TCP 192.168.29.92:52948 > 20.42.65.84:https A / Raw
[2025-06-15 17:44:54] Ether / IP / TCP 192.168.29.92:52948 > 20.42.65.84:https A / Raw
[2025-06-15 17:44:54] Ether / IP / TCP 192.168.29.92:52948 > 20.42.65.84:https PA / Raw
[2025-06-15 17:44:54] Ether / IP / TCP 20.42.65.84:https > 192.168.29.92:52948 A
[2025-06-15 17:44:54] Ether / IP / TCP 20.42.65.84:https > 192.168.29.92:52948 A
[2025-06-15 17:44:54] Ether / IP / TCP 20.42.65.84:https > 192.168.29.92:52948 PA / Raw
[2025-06-15 17:44:54] Ether / IP / TCP 192.168.29.92:52948 > 20.42.65.84:https A
[2025-06-15 17:44:55] Ether / IP / TCP 188.65.124.59:https > 192.168.29.92:52935 FA
[2025-06-15 17:44:55] Ether / IP / TCP 192.168.29.92:52935 > 188.65.124.59:https A
[2025-06-15 17:44:56] Ether / IP / TCP 192.168.29.92:52948 > 20.42.65.84:https PA / Raw
[2025-06-15 17:44:56] Ether / IP / TCP 192.168.29.92:52948 > 20.42.65.84:https A / Raw
[2025-06-15 17:44:56] Ether / IP / TCP 192.168.29.92:52948 > 20.42.65.84:https A / Raw
[2025-06-15 17:44:56] Ether / IP / TCP 192.168.29.92:52948 > 20.42.65.84:https A / Raw
[2025-06-15 17:44:56] Ether / IP / TCP 192.168.29.92:52948 > 20.42.65.84:https A / Raw
[2025-06-15 17:44:56] Ether / IP / TCP 192.168.29.92:52948 > 20.42.65.84:https PA / Raw
[2025-06-15 17:44:56] Ether / IP / TCP 20.42.65.84:https > 192.168.29.92:52948 A
[2025-06-15 17:44:56] Ether / IP / TCP 20.42.65.84:https > 192.168.29.92:52948 A
[2025-06-15 17:44:56] Ether / IP / TCP 20.42.65.84:https > 192.168.29.92:52948 PA / Raw
[2025-06-15 17:44:56] Ether / IP / TCP 192.168.29.92:52948 > 20.42.65.84:https A
[2025-06-15 17:44:57] Ether / IP / TCP 192.168.29.92:52907 > 13.107.5.91:https FA
[2025-06-15 17:44:57] Ether / IP / TCP 192.168.29.92:52908 > 23.35.47.228:http FA
[2025-06-15 17:44:58] Ether / IP / TCP 23.35.47.228:http > 192.168.29.92:52908 FA
[2025-06-15 17:44:58] Ether / IP / TCP 192.168.29.92:52908 > 23.35.47.228:http A
[2025-06-15 17:44:58] Ether / IP / TCP 13.107.5.91:https > 192.168.29.92:52907 A
[2025-06-15 17:44:58] Ether / IP / TCP 13.107.5.91:https > 192.168.29.92:52907 FA
[2025-06-15 17:44:58] Ether / IP / TCP 192.168.29.92:52907 > 13.107.5.91:https A
[2025-06-15 17:44:58] Ether / IP / TCP 192.168.29.92:52948 > 20.42.65.84:https PA / Raw
[2025-06-15 17:44:58] Ether / IP / TCP 192.168.29.92:52948 > 20.42.65.84:https A / Raw
[2025-06-15 17:44:58] Ether / IP / TCP 192.168.29.92:52948 > 20.42.65.84:https A / Raw
[2025-06-15 17:44:58] Ether / IP / TCP 192.168.29.92:52948 > 20.42.65.84:https A / Raw
[2025-06-15 17:44:58] Ether / IP / TCP 192.168.29.92:52948 > 20.42.65.84:https A / Raw
[2025-06-15 17:44:58] Ether / IP / TCP 192.168.29.92:52948 > 20.42.65.84:https PA / Raw
[2025-06-15 17:44:58] Ether / IP / TCP 20.42.65.84:https > 192.168.29.92:52948 A
[2025-06-15 17:44:58] Ether / IP / TCP 20.42.65.84:https > 192.168.29.92:52948 A
[2025-06-15 17:44:58] Ether / IP / TCP 20.42.65.84:https > 192.168.29.92:52948 PA / Raw
[2025-06-15 17:44:58] Ether / IP / TCP 192.168.29.92:52948 > 20.42.65.84:https PA / Raw
[2025-06-15 17:44:59] Ether / IP / TCP 20.42.65.84:https > 192.168.29.92:52948 A
[2025-06-15 17:45:00] Ether / IP / TCP 192.168.29.92:52948 > 20.42.65.84:https PA / Raw
[2025-06-15 17:45:00] Ether / IP / TCP 192.168.29.92:52948 > 20.42.65.84:https A / Raw
[2025-06-15 17:45:00] Ether / IP / TCP 192.168.29.92:52948 > 20.42.65.84:https A / Raw
[2025-06-15 17:45:00] Ether / IP / TCP 192.168.29.92:52948 > 20.42.65.84:https A / Raw
[2025-06-15 17:45:00] Ether / IP / TCP 192.168.29.92:52948 > 20.42.65.84:https A / Raw
[2025-06-15 17:45:00] Ether / IP / TCP 192.168.29.92:52948 > 20.42.65.84:https A / Raw
[2025-06-15 17:45:00] Ether / IP / TCP 192.168.29.92:52948 > 20.42.65.84:https A / Raw
[2025-06-15 17:45:00] Ether / IP / TCP 192.168.29.92:52948 > 20.42.65.84:https PA / Raw
[2025-06-15 17:45:01] Ether / IP / TCP 20.42.65.84:https > 192.168.29.92:52948 A
[2025-06-15 17:45:01] Ether / IP / TCP 20.42.65.84:https > 192.168.29.92:52948 A
[2025-06-15 17:45:01] Ether / IP / TCP 20.42.65.84:https > 192.168.29.92:52948 PA / Raw
[2025-06-15 17:45:01] Ether / IP / TCP 192.168.29.92:52948 > 20.42.65.84:https A
[2025-06-15 17:45:01] Ether / IP / UDP 192.168.29.1:60784 > 192.168.29.92:echo / Raw
[2025-06-15 17:45:02] Ether / IP / TCP 3.0.107.214:https > 192.168.29.92:52843 A
[2025-06-15 17:45:02] Ether / IP / TCP 192.168.29.92:52843 > 3.0.107.214:https A
[2025-06-15 17:45:02] Ether / IP / TCP 192.168.29.92:52915 > 20.42.65.94:https A / Raw
[2025-06-15 17:45:02] Ether / IP / TCP 20.42.65.94:https > 192.168.29.92:52915 A
[2025-06-15 17:45:02] Ether / 192.168.29.1 > 224.0.0.1 2 / Raw
[2025-06-15 17:45:02] Ether / IP / TCP 192.168.29.92:52948 > 20.42.65.84:https PA / Raw
[2025-06-15 17:45:02] Ether / IP / TCP 192.168.29.92:52948 > 20.42.65.84:https A / Raw
[2025-06-15 17:45:02] Ether / IP / TCP 192.168.29.92:52948 > 20.42.65.84:https A / Raw
[2025-06-15 17:45:02] Ether / IP / TCP 192.168.29.92:52948 > 20.42.65.84:https A / Raw
[2025-06-15 17:45:02] Ether / IP / TCP 192.168.29.92:52948 > 20.42.65.84:https A / Raw
[2025-06-15 17:45:02] Ether / IP / TCP 192.168.29.92:52948 > 20.42.65.84:https A / Raw
[2025-06-15 17:45:02] Ether / IP / TCP 192.168.29.92:52948 > 20.42.65.84:https A / Raw
[2025-06-15 17:45:02] Ether / IP / TCP 192.168.29.92:52948 > 20.42.65.84:https A / Raw
[2025-06-15 17:45:02] Ether / IP / TCP 192.168.29.92:52948 > 20.42.65.84:https A / Raw
[2025-06-15 17:45:02] Ether / IP / TCP 192.168.29.92:52948 > 20.42.65.84:https A / Raw
[2025-06-15 17:45:02] Ether / IP / TCP 192.168.29.92:52948 > 20.42.65.84:https PA / Raw
[2025-06-15 17:45:03] Ether / IP / TCP 20.42.65.84:https > 192.168.29.92:52948 A
[2025-06-15 17:45:03] Ether / IP / TCP 20.42.65.84:https > 192.168.29.92:52948 A
[2025-06-15 17:45:03] Ether / IP / TCP 20.42.65.84:https > 192.168.29.92:52948 A
[2025-06-15 17:45:03] Ether / IP / TCP 20.42.65.84:https > 192.168.29.92:52948 A
[2025-06-15 17:45:03] Ether / IP / TCP 20.42.65.84:https > 192.168.29.92:52948 A
[2025-06-15 17:45:03] Ether / IP / TCP 67.199.150.87:https > 192.168.29.92:52846 PA / Raw
[2025-06-15 17:45:03] Ether / IP / TCP 67.199.150.87:https > 192.168.29.92:52846 FA
[2025-06-15 17:45:03] Ether / IP / TCP 192.168.29.92:52846 > 67.199.150.87:https A
[2025-06-15 17:45:03] Ether / IP / TCP 192.168.29.92:52846 > 67.199.150.87:https FA
[2025-06-15 17:45:03] Ether / IP / TCP 67.199.150.87:https > 192.168.29.92:52846 A
[2025-06-15 17:45:03] Ether / 192.168.29.92 > 224.0.0.22 2 / Raw
[2025-06-15 17:45:04] Ether / IP / TCP 20.42.65.84:https > 192.168.29.92:52948 PA / Raw
[2025-06-15 17:45:04] Ether / IP / TCP 192.168.29.92:52948 > 20.42.65.84:https PA / Raw
[2025-06-15 17:45:04] Ether / IP / TCP 20.42.65.84:https > 192.168.29.92:52948 A
[2025-06-15 17:45:05] Ether / IP / TCP 192.168.29.92:52948 > 20.42.65.84:https PA / Raw
[2025-06-15 17:45:05] Ether / IP / TCP 192.168.29.92:52948 > 20.42.65.84:https A / Raw
[2025-06-15 17:45:05] Ether / IP / TCP 192.168.29.92:52948 > 20.42.65.84:https A / Raw
[2025-06-15 17:45:05] Ether / IP / TCP 192.168.29.92:52948 > 20.42.65.84:https A / Raw
[2025-06-15 17:45:05] Ether / IP / TCP 192.168.29.92:52948 > 20.42.65.84:https A / Raw
[2025-06-15 17:45:05] Ether / IP / TCP 192.168.29.92:52948 > 20.42.65.84:https A / Raw
[2025-06-15 17:45:05] Ether / IP / TCP 192.168.29.92:52948 > 20.42.65.84:https A / Raw
[2025-06-15 17:45:05] Ether / IP / TCP 192.168.29.92:52948 > 20.42.65.84:https A / Raw
[2025-06-15 17:45:05] Ether / IP / TCP 192.168.29.92:52948 > 20.42.65.84:https A / Raw
[2025-06-15 17:45:05] Ether / IP / TCP 192.168.29.92:52948 > 20.42.65.84:https A / Raw
[2025-06-15 17:45:05] Ether / IP / TCP 192.168.29.92:52948 > 20.42.65.84:https PA / Raw
[2025-06-15 17:45:05] Ether / IP / TCP 20.42.65.84:https > 192.168.29.92:52948 A
[2025-06-15 17:45:05] Ether / IP / TCP 20.42.65.84:https > 192.168.29.92:52948 A
[2025-06-15 17:45:05] Ether / IP / TCP 20.42.65.84:https > 192.168.29.92:52948 A
[2025-06-15 17:45:05] Ether / IP / TCP 20.42.65.84:https > 192.168.29.92:52948 A
[2025-06-15 17:45:05] Ether / IP / TCP 20.42.65.84:https > 192.168.29.92:52948 A
[2025-06-15 17:45:05] Ether / IP / TCP 20.42.65.84:https > 192.168.29.92:52948 PA / Raw
[2025-06-15 17:45:05] Ether / IP / TCP 192.168.29.92:52948 > 20.42.65.84:https A
[2025-06-15 17:45:05] Ether / IP / TCP 20.42.65.84:https > 192.168.29.92:52948 PA / Raw
[2025-06-15 17:45:05] Ether / IP / TCP 192.168.29.92:52948 > 20.42.65.84:https A
[2025-06-15 17:45:06] Ether / IP / TCP 192.168.29.92:52932 > 20.189.173.17:https A / Raw
[2025-06-15 17:45:06] Ether / 192.168.29.92 > 224.0.0.22 2 / Raw
[2025-06-15 17:45:06] Ether / IP / TCP 20.189.173.17:https > 192.168.29.92:52932 A
[2025-06-15 17:45:55] IP / TCP 192.168.1.2:1234 > 192.168.1.10:http S
[2025-06-15 17:45:55] IP / UDP 10.0.0.5:5000 > 10.0.0.10:domain
[2025-06-15 17:45:55] IP / ICMP 8.8.8.8 > 192.168.1.1 echo-request 0
[2025-06-15 17:48:54] Ether / IP / TCP 188.65.124.59:https > 192.168.29.92:52958 FA
[2025-06-15 17:48:54] Ether / IP / TCP 192.168.29.92:52958 > 188.65.124.59:https A
[2025-06-15 17:48:57] Ether / IP / TCP 192.168.29.92:52962 > 104.208.16.92:https S
[2025-06-15 17:48:57] Ether / IP / TCP 192.168.29.92:52963 > 104.208.16.92:https S
[2025-06-15 17:48:57] Ether / IP / TCP 104.208.16.92:https > 192.168.29.92:52962 SA
[2025-06-15 17:48:57] Ether / IP / TCP 192.168.29.92:52962 > 104.208.16.92:https A
[2025-06-15 17:48:57] Ether / IP / TCP 192.168.29.92:52962 > 104.208.16.92:https A / Raw
[2025-06-15 17:48:57] Ether / IP / TCP 192.168.29.92:52962 > 104.208.16.92:https PA / Raw
[2025-06-15 17:48:57] Ether / IP / TCP 104.208.16.92:https > 192.168.29.92:52963 SA
[2025-06-15 17:48:57] Ether / IP / TCP 192.168.29.92:52963 > 104.208.16.92:https A
[2025-06-15 17:48:57] Ether / IP / TCP 192.168.29.92:52963 > 104.208.16.92:https A / Raw
[2025-06-15 17:48:57] Ether / IP / TCP 192.168.29.92:52963 > 104.208.16.92:https PA / Raw
[2025-06-15 17:48:57] Ether / IP / TCP 104.208.16.92:https > 192.168.29.92:52962 A
[2025-06-15 17:48:57] Ether / IP / TCP 104.208.16.92:https > 192.168.29.92:52962 PA / Raw
[2025-06-15 17:48:57] Ether / IP / TCP 192.168.29.92:52962 > 104.208.16.92:https PA / Raw
[2025-06-15 17:48:58] Ether / IP / TCP 104.208.16.92:https > 192.168.29.92:52963 A
[2025-06-15 17:48:58] Ether / IP / TCP 104.208.16.92:https > 192.168.29.92:52962 A / Raw
[2025-06-15 17:48:58] Ether / IP / TCP 104.208.16.92:https > 192.168.29.92:52963 PA / Raw
[2025-06-15 17:48:58] Ether / IP / TCP 104.208.16.92:https > 192.168.29.92:52962 PA / Raw
[2025-06-15 17:48:58] Ether / IP / TCP 192.168.29.92:52962 > 104.208.16.92:https A
[2025-06-15 17:48:58] Ether / IP / TCP 192.168.29.92:52963 > 104.208.16.92:https PA / Raw
[2025-06-15 17:48:58] Ether / IP / TCP 192.168.29.92:52962 > 104.208.16.92:https PA / Raw
[2025-06-15 17:48:58] Ether / IP / TCP 192.168.29.92:52962 > 104.208.16.92:https PA / Raw
[2025-06-15 17:48:58] Ether / IP / TCP 192.168.29.92:52962 > 104.208.16.92:https PA / Raw
[2025-06-15 17:48:58] Ether / IP / TCP 192.168.29.92:52962 > 104.208.16.92:https A / Raw
[2025-06-15 17:48:58] Ether / IP / TCP 192.168.29.92:52962 > 104.208.16.92:https PA / Raw
[2025-06-15 17:48:58] Ether / IP / TCP 104.208.16.92:https > 192.168.29.92:52962 A
[2025-06-15 17:48:58] Ether / IP / TCP 104.208.16.92:https > 192.168.29.92:52962 A
[2025-06-15 17:48:58] Ether / IP / TCP 104.208.16.92:https > 192.168.29.92:52962 PA / Raw
[2025-06-15 17:48:58] Ether / IP / TCP 104.208.16.92:https > 192.168.29.92:52962 PA / Raw
[2025-06-15 17:48:58] Ether / IP / TCP 192.168.29.92:52962 > 104.208.16.92:https A
[2025-06-15 17:48:58] Ether / IP / TCP 192.168.29.92:52962 > 104.208.16.92:https PA / Raw
[2025-06-15 17:48:58] Ether / IP / TCP 104.208.16.92:https > 192.168.29.92:52963 A / Raw
[2025-06-15 17:48:58] Ether / IP / TCP 104.208.16.92:https > 192.168.29.92:52963 A / Raw
[2025-06-15 17:48:58] Ether / IP / TCP 192.168.29.92:52963 > 104.208.16.92:https A
[2025-06-15 17:48:58] Ether / IP / TCP 104.208.16.92:https > 192.168.29.92:52963 A / Raw
[2025-06-15 17:48:58] Ether / IP / TCP 104.208.16.92:https > 192.168.29.92:52963 A / Raw
[2025-06-15 17:48:58] Ether / IP / TCP 192.168.29.92:52963 > 104.208.16.92:https A
[2025-06-15 17:48:58] Ether / IP / TCP 104.208.16.92:https > 192.168.29.92:52963 PA / Raw
[2025-06-15 17:48:58] Ether / IP / TCP 192.168.29.92:52963 > 104.208.16.92:https PA / Raw
[2025-06-15 17:48:58] Ether / IP / TCP 104.208.16.92:https > 192.168.29.92:52962 PA / Raw
[2025-06-15 17:48:58] Ether / IP / TCP 104.208.16.92:https > 192.168.29.92:52963 PA / Raw
[2025-06-15 17:48:58] Ether / IP / TCP 104.208.16.92:https > 192.168.29.92:52963 PA / Raw
[2025-06-15 17:48:58] Ether / IP / TCP 192.168.29.92:52963 > 104.208.16.92:https A
[2025-06-15 17:48:58] Ether / IP / TCP 192.168.29.92:52962 > 104.208.16.92:https A
[2025-06-15 17:48:59] Ether / IP / TCP 192.168.29.92:52962 > 104.208.16.92:https PA / Raw
[2025-06-15 17:48:59] Ether / IP / TCP 192.168.29.92:52962 > 104.208.16.92:https A / Raw
[2025-06-15 17:48:59] Ether / IP / TCP 192.168.29.92:52962 > 104.208.16.92:https A / Raw
[2025-06-15 17:48:59] Ether / IP / TCP 192.168.29.92:52962 > 104.208.16.92:https A / Raw
[2025-06-15 17:48:59] Ether / IP / TCP 192.168.29.92:52962 > 104.208.16.92:https A / Raw
[2025-06-15 17:48:59] Ether / IP / TCP 192.168.29.92:52962 > 104.208.16.92:https A / Raw
[2025-06-15 17:48:59] Ether / IP / TCP 192.168.29.92:52962 > 104.208.16.92:https A / Raw
[2025-06-15 17:48:59] Ether / IP / TCP 192.168.29.92:52962 > 104.208.16.92:https A / Raw
[2025-06-15 17:48:59] Ether / IP / TCP 192.168.29.92:52962 > 104.208.16.92:https A / Raw
[2025-06-15 17:48:59] Ether / IP / TCP 192.168.29.92:52962 > 104.208.16.92:https A / Raw
[2025-06-15 17:48:59] Ether / IP / TCP 192.168.29.92:52962 > 104.208.16.92:https PA / Raw
[2025-06-15 17:48:59] Ether / IP / TCP 104.208.16.92:https > 192.168.29.92:52962 A
[2025-06-15 17:48:59] Ether / IP / TCP 104.208.16.92:https > 192.168.29.92:52962 A
[2025-06-15 17:48:59] Ether / IP / TCP 104.208.16.92:https > 192.168.29.92:52962 A
[2025-06-15 17:48:59] Ether / IP / TCP 104.208.16.92:https > 192.168.29.92:52962 PA / Raw
[2025-06-15 17:48:59] Ether / IP / TCP 192.168.29.92:52962 > 104.208.16.92:https A
[2025-06-15 17:50:45] Ether / IP / TCP 104.208.16.92:https > 192.168.29.92:52976 A
[2025-06-15 17:50:45] Ether / IP / TCP 104.208.16.92:https > 192.168.29.92:52976 PA / Raw
[2025-06-15 17:50:45] Ether / IP / TCP 192.168.29.92:52976 > 104.208.16.92:https A
[2025-06-15 17:50:45] Ether / IP / TCP 104.208.16.92:https > 192.168.29.92:52976 FPA / Raw
[2025-06-15 17:50:45] Ether / IP / TCP 192.168.29.92:52976 > 104.208.16.92:https A
[2025-06-15 17:50:45] Ether / IP / TCP 192.168.29.92:52976 > 104.208.16.92:https PA / Raw
[2025-06-15 17:50:45] Ether / IP / TCP 192.168.29.92:52976 > 104.208.16.92:https FA
[2025-06-15 17:50:45] Ether / IP / TCP 104.208.16.92:https > 192.168.29.92:52976 A
[2025-06-15 17:50:47] Ether / IP / TCP 192.168.29.92:52962 > 104.208.16.92:https PA / Raw
[2025-06-15 17:50:47] Ether / IP / TCP 192.168.29.92:52962 > 104.208.16.92:https PA / Raw
[2025-06-15 17:50:47] Ether / IP / TCP 192.168.29.92:52962 > 104.208.16.92:https A / Raw
[2025-06-15 17:50:47] Ether / IP / TCP 192.168.29.92:52962 > 104.208.16.92:https A / Raw
[2025-06-15 17:50:47] Ether / IP / TCP 192.168.29.92:52962 > 104.208.16.92:https A / Raw
[2025-06-15 17:50:47] Ether / IP / TCP 192.168.29.92:52962 > 104.208.16.92:https A / Raw
[2025-06-15 17:50:47] Ether / IP / TCP 192.168.29.92:52962 > 104.208.16.92:https PA / Raw
[2025-06-15 17:50:47] Ether / IP / TCP 104.208.16.92:https > 192.168.29.92:52962 A
[2025-06-15 17:50:47] Ether / IP / TCP 104.208.16.92:https > 192.168.29.92:52962 PA / Raw
[2025-06-15 17:50:47] Ether / IP / TCP 104.208.16.92:https > 192.168.29.92:52962 A
[2025-06-15 17:50:47] Ether / IP / TCP 104.208.16.92:https > 192.168.29.92:52962 A
[2025-06-15 17:50:47] Ether / IP / TCP 104.208.16.92:https > 192.168.29.92:52962 A
[2025-06-15 17:50:47] Ether / IP / TCP 192.168.29.92:52962 > 104.208.16.92:https A
[2025-06-15 17:50:48] Ether / IP / TCP 104.208.16.92:https > 192.168.29.92:52962 PA / Raw
[2025-06-15 17:50:48] Ether / IP / TCP 192.168.29.92:52962 > 104.208.16.92:https PA / Raw
[2025-06-15 17:50:48] Ether / IP / TCP 104.208.16.92:https > 192.168.29.92:52962 A
[2025-06-15 17:50:49] Ether / IP / TCP 192.168.29.92:52962 > 104.208.16.92:https PA / Raw
[2025-06-15 17:50:49] Ether / IP / TCP 192.168.29.92:52962 > 104.208.16.92:https A / Raw
[2025-06-15 17:50:49] Ether / IP / TCP 192.168.29.92:52962 > 104.208.16.92:https A / Raw
[2025-06-15 17:50:49] Ether / IP / TCP 192.168.29.92:52962 > 104.208.16.92:https A / Raw
[2025-06-15 17:50:49] Ether / IP / TCP 192.168.29.92:52962 > 104.208.16.92:https A / Raw
[2025-06-15 17:50:49] Ether / IP / TCP 192.168.29.92:52962 > 104.208.16.92:https A / Raw
[2025-06-15 17:50:49] Ether / IP / TCP 192.168.29.92:52962 > 104.208.16.92:https A / Raw
[2025-06-15 17:50:49] Ether / IP / TCP 192.168.29.92:52962 > 104.208.16.92:https A / Raw
[2025-06-15 17:50:49] Ether / IP / TCP 192.168.29.92:52962 > 104.208.16.92:https A / Raw
[2025-06-15 17:50:49] Ether / IP / TCP 192.168.29.92:52962 > 104.208.16.92:https A / Raw
[2025-06-15 17:50:49] Ether / IP / TCP 192.168.29.92:52962 > 104.208.16.92:https PA / Raw
[2025-06-15 17:50:49] Ether / IP / TCP 104.208.16.92:https > 192.168.29.92:52962 A
[2025-06-15 17:50:49] Ether / IP / TCP 104.208.16.92:https > 192.168.29.92:52962 A
[2025-06-15 17:50:49] Ether / IP / TCP 104.208.16.92:https > 192.168.29.92:52962 A
[2025-06-15 17:50:49] Ether / IP / TCP 104.208.16.92:https > 192.168.29.92:52962 PA / Raw
[2025-06-15 17:50:49] Ether / IP / TCP 188.65.124.59:https > 192.168.29.92:52974 FA
[2025-06-15 17:50:49] Ether / IP / TCP 192.168.29.92:52974 > 188.65.124.59:https A
[2025-06-15 17:50:49] Ether / IP / TCP 192.168.29.92:52962 > 104.208.16.92:https A
[2025-06-15 17:50:50] Ether / 192.168.29.92 > 224.0.0.22 2 / Raw
[2025-06-15 17:50:51] Ether / 192.168.29.92 > 224.0.0.22 2 / Raw
[2025-06-15 17:50:51] Ether / IP / TCP 192.168.29.92:52962 > 104.208.16.92:https PA / Raw
[2025-06-15 17:50:51] Ether / IP / TCP 192.168.29.92:52962 > 104.208.16.92:https A / Raw
[2025-06-15 17:50:51] Ether / IP / TCP 192.168.29.92:52962 > 104.208.16.92:https A / Raw
[2025-06-15 17:50:51] Ether / IP / TCP 192.168.29.92:52962 > 104.208.16.92:https A / Raw
[2025-06-15 17:50:51] Ether / IP / TCP 192.168.29.92:52962 > 104.208.16.92:https A / Raw
[2025-06-15 17:50:51] Ether / IP / TCP 192.168.29.92:52962 > 104.208.16.92:https A / Raw
[2025-06-15 17:50:51] Ether / IP / TCP 192.168.29.92:52962 > 104.208.16.92:https A / Raw
[2025-06-15 17:50:51] Ether / IP / TCP 192.168.29.92:52962 > 104.208.16.92:https A / Raw
[2025-06-15 17:50:51] Ether / IP / TCP 192.168.29.92:52962 > 104.208.16.92:https A / Raw
[2025-06-15 17:50:51] Ether / IP / TCP 192.168.29.92:52962 > 104.208.16.92:https PA / Raw
[2025-06-15 17:50:52] Ether / IP / TCP 104.208.16.92:https > 192.168.29.92:52962 A
[2025-06-15 17:50:52] Ether / IP / TCP 104.208.16.92:https > 192.168.29.92:52962 A
[2025-06-15 17:50:52] Ether / IP / TCP 104.208.16.92:https > 192.168.29.92:52962 A
[2025-06-15 17:50:52] Ether / IP / TCP 104.208.16.92:https > 192.168.29.92:52962 PA / Raw
[2025-06-15 17:50:52] Ether / IP / TCP 192.168.29.92:52962 > 104.208.16.92:https A
[2025-06-15 17:50:52] Ether / 192.168.29.92 > 224.0.0.22 2 / Raw
[2025-06-15 17:51:24] IP / TCP 192.168.1.2:1234 > 192.168.1.10:http S
[2025-06-15 17:51:24] IP / UDP 10.0.0.5:5000 > 10.0.0.10:domain
[2025-06-15 17:51:24] IP / ICMP 8.8.8.8 > 192.168.1.1 echo-request 0
